{
  "schema_version": "1.0",
  "request_id": "synthetic-request",
  "as_of": "2026-10-19T17:00:00+08:00",
  "horizon_months": 36,
  "base_currency": "TWD",
  "source_inputs": [],
  "universe": {
    "mode": "tickers",
    "instruments": [
      {
        "ticker": "0000",
        "name": "合成測試公司",
        "market": "TWSE",
        "asset_type": "stock",
        "currency": "TWD"
      },
      {
        "ticker": "00000A",
        "name": "合成測試 ETF",
        "market": "TWSE",
        "asset_type": "etf",
        "currency": "TWD"
      }
    ],
    "selector": null,
    "coverage": "sample"
  },
  "benchmark": "待選定官方含息基準",
  "filters": {
    "min_20d_turnover_twd": null,
    "exclusions": []
  },
  "stock_weights": {
    "valuation": 0.2,
    "quality": 0.25,
    "momentum": 0.2,
    "sentiment": 0.15,
    "growth": 0.2
  }
}
